{
  "artifact_version": 1,
  "business_outcomes": [
    {
      "code": "MEMBER_NOT_FOUND",
      "description": "The portal reported that no member matched the supplied identifier.",
      "detection_text": "Member not found"
    }
  ],
  "capability_id": "member-balance-v1",
  "checkpoint": {
    "description": "The member details panel is visible.",
    "kind": "text_present",
    "value": "Member details"
  },
  "created_at": "2026-09-15T03:24:09.401605+00:00",
  "description": "Find a member in the synthetic member services console and read the current savings balance.",
  "name": "Read member balance",
  "outputs": {
    "balance": {
      "description": "Current savings balance displayed by the portal.",
      "sensitive": true,
      "source": {
        "rationale": "Stable author-provided id for a readable output target.",
        "strategy": "css",
        "value": "#balance-value"
      },
      "type": "string"
    }
  },
  "parameters": {
    "member_id": {
      "description": "Synthetic member identifier supplied by the caller.",
      "required": true,
      "type": "string"
    }
  },
  "schema_version": "1.0",
  "steps": [
    {
      "action": "fill",
      "description": "enter the requested member identifier",
      "id": "step-1-1",
      "risk": "safe",
      "target": {
        "rationale": "Associated form label is more stable than position or generated markup.",
        "strategy": "label",
        "value": "Member ID"
      },
      "timeout_ms": 5000,
      "value": "{{member_id}}"
    },
    {
      "action": "click",
      "description": "submit the lookup form",
      "id": "step-2-1",
      "risk": "safe",
      "target": {
        "rationale": "Accessible role and visible name survive table/layout changes.",
        "strategy": "role",
        "value": "button:Search"
      },
      "timeout_ms": 5000
    },
    {
      "action": "extract",
      "description": "read the current savings balance",
      "id": "step-3-1",
      "risk": "safe",
      "target": {
        "rationale": "Stable author-provided id for a readable output target.",
        "strategy": "css",
        "value": "#balance-value"
      },
      "timeout_ms": 5000,
      "value": "balance"
    }
  ],
  "surface_kind": "browser",
  "target": {
    "origin": "http://127.0.0.1:8765",
    "url": "http://127.0.0.1:8765/"
  }
}
